{
  "eventId": "1d2e3f40-5a6b-4c7d-8e9f-a0b1c2d3e4f5",
  "eventType": "ParcelAssigned",
  "eventVersion": 1,
  "occurredAt": "2026-10-20T09:00:05Z",
  "correlationId": "77aa88bb-99cc-4ddd-8eee-ffff00001111",
  "producer": "dispatch-service",
  "data": {
    "assignmentId": "2c3d4e5f-6a7b-4c8d-9e0f-1a2b3c4d5e6f",
    "parcelId": "0b6f4a9e-7c1d-4e2f-9a3b-5c6d7e8f9a0b",
    "trackingNumber": "SD261020K7Q2M9X",
    "courierId": "a1b2c3d4-0000-4000-8000-00000000c001",
    "previousCourierId": null,
    "runDate": "2026-10-20",
    "assignedBy": { "userId": "d15a7c4e-0000-4000-8000-0000000d1500", "role": "DISPATCHER" },
    "assignedAt": "2026-10-20T09:00:04Z"
  }
}
